,tweet_id,source_app,text,rating_numerator,rating_denominator,name,date,time,timezone,dog_type,retweet_count,fav_count
909,728760639972315136,Twitter for iPhone,"When you're way too slow for the ""down low"" portion of a high five. 13/10 https://t.co/Cofwoy7Vpq",13.0,10,None,2016-05-07,01:37:30,+00:00,doggo,4521,1642
910,728751179681943552,Twitter for iPhone,This is Flurpson. He can't believe it's not butter. 10/10 https://t.co/XD3ort1PsE,10.0,10,Flurpson,2016-05-07,00:59:55,+00:00,doggo,2683,651
911,728653952833728512,Twitter for iPhone,This is Coleman. Somebody needs to tell him that he's sitting in chairs wrong. 8/10 https://t.co/O10zjJ2Ixs,8.0,10,Coleman,2016-05-06,18:33:34,+00:00,doggo,3214,1001
912,728409960103686147,Twitter for iPhone,This is Wallace. He's a skater pup. He said see ya later pup. Can easily do a kick flip. Gnarly af. 10/10 v petable https://t.co/5i8fORVKgr,10.0,10,Wallace,2016-05-06,02:24:02,+00:00,doggo,4757,1923
913,728387165835677696,Twitter for iPhone,"This is Enchilada (yes, that's her real name). She's a Low-Cruisin Plopflopple. Very rare. Only a few left. 12/10 https://t.co/SiaiTWgsfP",12.0,10,Enchilada,2016-05-06,00:53:27,+00:00,doggo,3599,928
914,728046963732717569,Twitter for iPhone,This is Raymond. He controls fountains with his tongue. 11/10 pretty damn magical https://t.co/9aMxSbOaAZ,11.0,10,Raymond,2016-05-05,02:21:37,+00:00,doggo,4154,1161
915,728035342121635841,Twitter for iPhone,This is all I want in my life. 12/10 for super sleepy pupper https://t.co/4RlLA5ObMh,12.0,10,,2016-05-05,01:35:26,+00:00,pupper,4404,1616
916,728015554473250816,Twitter for iPhone,This is Rueben. He has reached ultimate pupper zen state. 11/10 tranquil af https://t.co/Z167HgtnBi,11.0,10,Rueben,2016-05-05,00:16:48,+00:00,pupper,3995,1065
917,727685679342333952,Twitter for iPhone,This is Cilantro. She's a Fellation Gadzooks. Eyes are super magical af. 12/10 could get lost in https://t.co/yJ26LNuyj5,12.0,10,Cilantro,2016-05-04,02:26:00,+00:00,doggo,2872,615
918,727644517743104000,Twitter for iPhone,Here's a doggo struggling to cope with the winds. 13/10 https://t.co/qv3aUwaouT,13.0,10,None,2016-05-03,23:42:26,+00:00,doggo,5686,1684
919,727524757080539137,Twitter for iPhone,This pupper had to undergo emergency haircut surgery so he could hear again. 10/10 miraculous af https://t.co/fUyDIFkBwx,10.0,10,None,2016-05-03,15:46:33,+00:00,pupper,4342,1178
920,727314416056803329,Twitter for iPhone,This pupper was about to explain where that dirt came from but then decided against it. 11/10 https://t.co/SbaelU6zRs,11.0,10,None,2016-05-03,01:50:44,+00:00,pupper,3237,716
921,727286334147182592,Twitter for iPhone,I swear to god if we get sent another Blue Madagascan Peacock we'll deactivate. We ðŸ‘ Only ðŸ‘ Rate ðŸ‘ Dogs... 9/10 https://t.co/bbta2Q4URK,9.0,10,None,2016-05-02,23:59:09,+00:00,doggo,2964,788
922,727175381690781696,Twitter for iPhone,This is Karll. He just wants to go kayaking. 10/10 please someone take Karll kayaking already https://t.co/vXLkvyNQHp,10.0,10,Karll,2016-05-02,16:38:15,+00:00,doggo,3795,1340
923,727155742655025152,Vine - Make a Scene,When you're trying to enjoy yourself but end up having to take care of your way too drunk friend. 11/10 https://t.co/BRkhj6tdN0,11.0,10,None,2016-05-02,15:20:13,+00:00,doggo,3516,1279
924,726935089318363137,Twitter for iPhone,This is Sprout. He's just precious af. 12/10 I'd do anything for Sprout https://t.co/DxlX1yTVYY,12.0,10,Sprout,2016-05-02,00:43:25,+00:00,doggo,6657,2345
925,726887082820554753,Twitter for iPhone,This is Blitz. He's a new dad struggling to cope mentally with the pressures of being a father. Sick shades 10/10 https://t.co/2AVcJ2BZsy,10.0,10,Blitz,2016-05-01,21:32:40,+00:00,doggo,3714,1463
926,726828223124897792,Twitter for iPhone,This is Bloop. He's a Phoenician Winnebago. Tongue is just wow. That box is all he has (tragic). 12/10 would caress https://t.co/DWNrPPXgHA,12.0,10,Bloop,2016-05-01,17:38:46,+00:00,doggo,3461,972
927,726224900189511680,Twitter for iPhone,I'm getting super heckin frustrated with you all sending in non canines like this ostrich. We only rate dogs... 9/10 https://t.co/Rgbni2Ns8z,9.0,10,None,2016-04-30,01:41:23,+00:00,doggo,4287,1101
928,725842289046749185,Twitter for iPhone,This is Colby. He's currently regretting all those times he shook your hand for an extra treat. 12/10 https://t.co/vtVHtKFtBH,12.0,10,Colby,2016-04-29,00:21:01,+00:00,doggo,6871,2568
929,725786712245440512,Twitter for iPhone,Say hello to Lillie. She's a Rutabagan Floofem. Poor pupper ate and then passed out. 11/10 relatable af https://t.co/uIdGqug9rw,11.0,10,Lillie,2016-04-28,20:40:11,+00:00,pupper,4049,1329
930,725729321944506368,Twitter for iPhone,This is Lola. She's a Butternut Splishnsplash. They are known to be ferocious af. 12/10 would absolutely still pet https://t.co/adQt5a6TZU,12.0,10,Lola,2016-04-28,16:52:08,+00:00,doggo,5055,1716
931,725458796924002305,Twitter for iPhone,"Pup had to be removed cuz it wouldn't have been fair to the opposing team. 13/10 absolute legend âš½ï¸
https://t.co/BHICimO58W",13.0,10,None,2016-04-27,22:57:10,+00:00,doggo,1374,594
932,724983749226668032,Twitter for iPhone,This is Fred-Rick. He dabbles in parkour. The elevation gives him power. 12/10 hopefully visiting a mailbox near you https://t.co/qFqLtudIiD,12.0,10,Fred,2016-04-26,15:29:30,+00:00,doggo,3624,1259
933,724771698126512129,Twitter for iPhone,Nothin better than a doggo and a sunset. 11/10 https://t.co/JlFqOhrHEs,11.0,10,None,2016-04-26,01:26:53,+00:00,doggo,2272,610
934,724405726123311104,Twitter for iPhone,This is Ashleigh. She's having Coachella withdrawals. Didn't even go tho. 10/10 stay strong pupper https://t.co/nRUaKWnJfH,10.0,10,Ashleigh,2016-04-25,01:12:38,+00:00,pupper,5125,1600
935,724049859469295616,Twitter for iPhone,This is Kreggory. He just took a look at his student debt. 10/10 can't even comprehend it https://t.co/XTsZTgilnT,10.0,10,Kreggory,2016-04-24,01:38:33,+00:00,doggo,4209,1718
936,724046343203856385,Twitter for iPhone,"This is Sarge. Not even he knows what his tongue is doing, but it's pretty damn spectacular. 10/10 https://t.co/pIQEdbBxdL",10.0,10,Sarge,2016-04-24,01:24:35,+00:00,doggo,2584,539
937,724004602748780546,Twitter for iPhone,This is Luther. He saw a ghost. Spooked af. 11/10 hang in there pupper https://t.co/EdKG43VvEl,11.0,10,Luther,2016-04-23,22:38:43,+00:00,pupper,4070,1488
938,723912936180330496,Twitter for iPhone,This is Sugar. She's a Bolivian Superfloof. Spherical af. 12/10 would never let go of https://t.co/AhMfUu6Onm,12.0,10,Sugar,2016-04-23,16:34:28,+00:00,doggo,3772,1187
939,723688335806480385,Twitter for iPhone,This is Reginald. He starts screaming at random. 12/10 cuddly af https://t.co/YgNuDQbv89,12.0,10,Reginald,2016-04-23,01:41:59,+00:00,doggo,7432,2830
940,723673163800948736,Twitter for iPhone,This is Ivar. She is a badass Viking warrior. Will sack your village. 10/10 savage af https://t.co/Dz6MiVssVU,10.0,10,Ivar,2016-04-23,00:41:42,+00:00,doggo,2927,856
941,723179728551723008,Twitter for iPhone,This is Jangle. She's addicted to broccoli. It's the only thing she cares about. Tragic af. 8/10 get help pup https://t.co/8dNWp1cSEa,8.0,10,Jangle,2016-04-21,16:00:57,+00:00,doggo,5129,1787
942,722974582966214656,Twitter for iPhone,Happy 4/20 from the squad! 13/10 for all https://t.co/eV1diwds8a,4.0,20,None,2016-04-21,02:25:47,+00:00,doggo,3969,1515
943,722613351520608256,Twitter for iPhone,Meet Schnitzel. He's a Tropicana Floofboop. Getting too big for his favorite basket. 12/10 just so damn fluffy https://t.co/qjd0UJKYUY,12.0,10,Schnitzel,2016-04-20,02:30:23,+00:00,doggo,4828,1579
944,721503162398597120,Twitter for iPhone,This is Panda. He's happy af. 11/10 https://t.co/IOAk9i4UvE,11.0,10,Panda,2016-04-17,00:58:53,+00:00,doggo,4474,1762
945,721001180231503872,Twitter for iPhone,This is Oliver. Bath time is upon him. His fear of the wetness postpones his ultimate pupper destiny. 11/10 https://t.co/AFzzKqR4tT,11.0,10,Oliver,2016-04-15,15:44:11,+00:00,pupper,2458,589
946,720785406564900865,Twitter for iPhone,This is Archie. He hears everything you say. Doesn't matter where you are. 12/10 https://t.co/0l4I8famYp,12.0,10,Archie,2016-04-15,01:26:47,+00:00,doggo,3013,739
947,720775346191278080,Twitter for iPhone,This is Berkeley. He's in a predicament. 10/10 someone help him https://t.co/XSEXdQupej,10.0,10,Berkeley,2016-04-15,00:46:48,+00:00,doggo,2390,638
948,720415127506415616,Twitter for iPhone,Garden's coming in nice this year. 10/10 https://t.co/5Lra3e4rrw,10.0,10,None,2016-04-14,00:55:25,+00:00,doggo,4008,1448
949,720389942216527872,Twitter for iPhone,This is RalphÃ©. He patrols the lake. Looking for babes. 11/10 https://t.co/Pb6iMmo0wk,11.0,10,RalphÃ©,2016-04-13,23:15:21,+00:00,doggo,6170,2412
950,720340705894408192,Twitter for iPhone,This is Derek. He just got balled on. Can't even get up. Poor thing. 10/10 hang in there pupper https://t.co/BIRRF3bcWH,10.0,10,Derek,2016-04-13,19:59:42,+00:00,pupper,2774,943
951,720059472081784833,Twitter for iPhone,This is Charleson. He lost his plunger. Looked everywhere. Can't find it. So sad. 9/10 would comfort https://t.co/pRHX8yn9Yu,9.0,10,Charleson,2016-04-13,01:22:10,+00:00,doggo,3738,1081
952,720043174954147842,Twitter for iPhone,This is Neptune. He's a Snowy Swiss Mountain Floofapolis. Cheeky wink. Tongue nifty af. 11/10 would pet so firmly https://t.co/SoZq2Xoopv,11.0,10,Neptune,2016-04-13,00:17:25,+00:00,doggo,4770,1937
953,719991154352222208,Twitter for iPhone,This doggo was initially thrilled when she saw the happy cartoon pup but quickly realized she'd been deceived. 10/10 https://t.co/mvnBGaWULV,10.0,10,None,2016-04-12,20:50:42,+00:00,doggo,4686,1680
954,719704490224398336,Twitter for iPhone,This is Clyde. He's making sure you're having a good train ride. 12/10 great pupper https://t.co/y206kWHAj0,12.0,10,Clyde,2016-04-12,01:51:36,+00:00,pupper,4406,1375
955,719551379208073216,Twitter for iPhone,This is Harnold. He accidentally opened the front facing camera. 10/10 get it together Harnold https://t.co/S6JHaSMtln,10.0,10,Harnold,2016-04-11,15:43:12,+00:00,doggo,4911,1824
956,719367763014393856,Twitter for iPhone,Meet Sid &amp; Murphy. Murphy floats alongside Sid and whispers motivational quotes in his ear. Magical af. Both 11/10 https://t.co/7mmjyearQW,11.0,10,Sid,2016-04-11,03:33:34,+00:00,doggo,2710,718
957,719339463458033665,Twitter for iPhone,Say hello to Lucy and Sophie. They think they're the same size. Both 10/10 would snug at same time https://t.co/HW50zkcf2R,10.0,10,Lucy,2016-04-11,01:41:07,+00:00,doggo,4296,1188
958,719332531645071360,Twitter for iPhone,This is Pippa. She managed to start the car but is waiting for you to buckle up before driving. Responsible af 11/10 https://t.co/htrlmC7saz,11.0,10,Pippa,2016-04-11,01:13:34,+00:00,doggo,3331,915
959,718971898235854848,Twitter for iPhone,This is Sadie. She is prepared for battle. 10/10 https://t.co/JRckDkZVRT,10.0,10,Sadie,2016-04-10,01:20:33,+00:00,doggo,3370,1041
960,718939241951195136,Twitter for iPhone,This is Otis. Everybody look at Otis. 12/10 would probably faint while petting https://t.co/I9qoe1uEih,12.0,10,Otis,2016-04-09,23:10:47,+00:00,doggo,5092,1689
961,718631497683582976,Twitter for iPhone,We normally don't rate marshmallows but this one appears to be flawlessly toasted so I'll make an exception. 10/10 https://t.co/D9jbbmPmos,10.0,10,None,2016-04-09,02:47:55,+00:00,doggo,18297,7734
962,718613305783398402,Twitter for iPhone,This is Carper. He's a Tortellini Angiosperm. In desperate need of a petting. 11/10 would hug softly https://t.co/lK9YDkRzPj,11.0,10,Carper,2016-04-09,01:35:37,+00:00,doggo,2361,462
963,718540630683709445,Twitter for iPhone,Get you a pup that can do both. 10/10 https://t.co/zSbyvm62xZ,10.0,10,None,2016-04-08,20:46:50,+00:00,doggo,2376,973
964,718460005985447936,Twitter for iPhone,Meet Bowie. He's listening for underground squirrels. Smart af. Left eye is considerably magical. 9/10 would so pet https://t.co/JyNmyjy3fe,9.0,10,Bowie,2016-04-08,15:26:28,+00:00,doggo,2615,505
965,718454725339934721,Twitter for iPhone,"This pic is old but I hadn't seen it until today and had to share. Creative af. 13/10 very good boy, would pet well https://t.co/4kD16wMA1Z",13.0,10,None,2016-04-08,15:05:29,+00:00,doggo,4717,1459
966,718246886998687744,Twitter for iPhone,This is Alexanderson. He's got a weird ass birth mark. Dreadful at fetch. Won't eat kibble. 3/10 wtf @Target https://t.co/FmxOpf2Sgl,3.0,10,Alexanderson,2016-04-08,01:19:36,+00:00,doggo,1851,480
967,718234618122661888,Twitter for iPhone,This is Suki. She was born with a blurry tail (unfortunate). Next level tongue tho. 11/10 nifty hardwood https://t.co/05S8oYztgb,11.0,10,Suki,2016-04-08,00:30:51,+00:00,doggo,3748,955
968,717841801130979328,Twitter for iPhone,This is Barclay. His father was a banana. 11/10 appeeling af https://t.co/ucOEfr2rjV,11.0,10,Barclay,2016-04-06,22:29:56,+00:00,doggo,2382,580
969,717790033953034240,Twitter for iPhone,"Here's a badass mystery pupper. You weren't aware that you owe him money, but you do. 10/10 shades sick af https://t.co/fv9e9AtzSG",10.0,10,None,2016-04-06,19:04:14,+00:00,pupper,2782,1065
970,717537687239008257,Twitter for iPhone,People please. This is a Deadly Mediterranean Plop T-Rex. We only rate dogs. Only send in dogs. Thanks you... 11/10 https://t.co/2ATDsgHD4n,11.0,10,,2016-04-06,02:21:30,+00:00,doggo,5595,1780
971,717428917016076293,Vine - Make a Scene,This is Skittle. He's trying to communicate. 11/10 solid effort https://t.co/6WTfJvtKx6,11.0,10,Skittle,2016-04-05,19:09:17,+00:00,doggo,1570,430
972,717421804990701568,Twitter for iPhone,This is Ebby. She's a Zimbabwean Feta. Embarrassed by ridiculously squishy face. 9/10 would squeeze softly https://t.co/LBJqxMGaHi,9.0,10,Ebby,2016-04-05,18:41:02,+00:00,doggo,3057,809
973,717047459982213120,Twitter for iPhone,This is FlÃ¡vio (pronounced Baxter). He's a Benesnoop Cumberdog. Super rare. Symmetrical. 12/10 would pet so well https://t.co/fGgleFiBPq,12.0,10,FlÃ¡vio,2016-04-04,17:53:31,+00:00,doggo,6088,1855
974,717009362452090881,Twitter for iPhone,This is Smokey. He's having some sort of existential crisis. 10/10 hang in there pupper https://t.co/JmgF4dMpw0,10.0,10,Smokey,2016-04-04,15:22:08,+00:00,pupper,3137,927
975,716802964044845056,Twitter for iPhone,This is Link. He struggles with couches. 10/10 would assist https://t.co/SbX4e6Yg3o,10.0,10,Link,2016-04-04,01:41:58,+00:00,doggo,4150,1131
976,716791146589110272,Twitter for iPhone,Meet Jennifur. She's supposed to be navigating. Not even buckled up. Insubordinate &amp; churlish. 11/10 would still pet https://t.co/h0trcJohYO,11.0,10,Jennifur,2016-04-04,00:55:01,+00:00,doggo,7946,1521
977,716730379797970944,Twitter for iPhone,"There has clearly been a mistake. Pup did nothing wrong. 12/10 would help escape
https://t.co/Juid3nnLbC",12.0,10,None,2016-04-03,20:53:33,+00:00,doggo,1197,414
978,716447146686459905,Vine - Make a Scene,This is Ozzy. He's acrobatic af. Legendary pupper status achieved. 13/10 https://t.co/gHWsCTu90E,13.0,10,Ozzy,2016-04-03,02:08:05,+00:00,pupper,12640,5645
979,716439118184652801,Twitter for iPhone,This is Bluebert. He just saw that both #FinalFur match ups are split 50/50. Amazed af. 11/10 https://t.co/Kky1DPG4iq,50.0,50,Bluebert,2016-04-03,01:36:11,+00:00,doggo,2317,202
980,716285507865542656,Twitter for iPhone,This is Stephanus. She stays woke. 12/10 https://t.co/WIWabMngQZ,12.0,10,Stephanus,2016-04-02,15:25:47,+00:00,doggo,2685,1012
981,716080869887381504,Twitter for iPhone,Here's a super majestic doggo and a sunset 11/10 https://t.co/UACnoyi8zu,11.0,10,None,2016-04-02,01:52:38,+00:00,doggo,6568,1835
982,715928423106027520,Twitter for iPhone,This is Bubbles. He's a Yorkshire Piccolope. 11/10 would snug aggressively https://t.co/3BhMojONxq,11.0,10,Bubbles,2016-04-01,15:46:52,+00:00,doggo,3090,849
983,715758151270801409,Vine - Make a Scene,This is old now but it's absolutely heckin fantastic and I can't not share it with you all. 13/10  https://t.co/wJX74TSgzP,13.0,10,,2016-04-01,04:30:16,+00:00,doggo,3601,1377
984,715733265223708672,Twitter for iPhone,This is a taco. We only rate dogs. Please only send in dogs. Dogs are what we rate. Not tacos. Thank you... 10/10 https://t.co/cxl6xGY8B9,10.0,10,,2016-04-01,02:51:22,+00:00,doggo,4521,1631
985,715704790270025728,Vine - Make a Scene,This is Bentley. He gives kisses back. 11/10 precious af (vid by @emmaallen25) https://t.co/9PnKkKzoUp,11.0,10,Bentley,2016-04-01,00:58:13,+00:00,doggo,2695,552
986,715696743237730304,Twitter for iPhone,Meet Toby. He's a Lithuanian High-Steppin Stickeroo. One of the more accomplished Stickeroos around. 10/10 so nifty https://t.co/cYPHuJYTjC,10.0,10,Toby,2016-04-01,00:26:15,+00:00,doggo,3793,1251
987,715680795826982913,Twitter for iPhone,This is Zeus. He's downright fabulous. 12/10 https://t.co/sSugyyRuTp,12.0,10,Zeus,2016-03-31,23:22:53,+00:00,doggo,4153,1554
988,715360349751484417,Twitter for iPhone,This is Bertson. He just wants to say hi. 11/10 would boop nose https://t.co/hwv7Wq6gDA,11.0,10,Bertson,2016-03-31,02:09:32,+00:00,doggo,5298,1510
989,715342466308784130,Twitter for iPhone,This is Oscar. He's a world renowned snowball inspector. It's a ruff job but someone has to do it. 10/10 great guy https://t.co/vSufMAKm3C,10.0,10,Oscar,2016-03-31,00:58:29,+00:00,doggo,2955,665
990,715220193576927233,Twitter for iPhone,This is Nico. His selfie game is strong af. Excellent use of a sneaky tongue slip. 10/10 star material https://t.co/1OBdJkMOFx,10.0,10,Nico,2016-03-30,16:52:36,+00:00,doggo,2352,624
991,715200624753819648,Twitter for iPhone,This is Michelangelope. He's half coffee cup. Rare af. 12/10 would hug until someone stopped me https://t.co/tvVDY0G911,12.0,10,Michelangelope,2016-03-30,15:34:51,+00:00,doggo,4982,1801
992,715009755312439296,Twitter for iPhone,This is Siba. She's remarkably mobile. Very sleepy as well. 12/10 would happily transport https://t.co/TjnI33RE1i,12.0,10,Siba,2016-03-30,02:56:24,+00:00,doggo,4017,1181
993,714982300363173890,Twitter for iPhone,This is Calbert. He forgot to clear his Google search history. 9/10 rookie mistake Calbert https://t.co/jRm5J3YCmj,9.0,10,Calbert,2016-03-30,01:07:18,+00:00,doggo,3604,1000
994,714962719905021952,Vine - Make a Scene,Just in case anyone's having a bad day. 12/10 would bounce with https://t.co/T9sgP9ttnQ,12.0,10,None,2016-03-29,23:49:30,+00:00,doggo,7115,4100
995,714957620017307648,Twitter for iPhone,This is Curtis. He's an Albino Haberdasher. Terrified of dandelions. They really spook him up. 10/10 it'll be ok pup https://t.co/s8YcfZrWhK,10.0,10,Curtis,2016-03-29,23:29:14,+00:00,doggo,4019,1361
996,714631576617938945,Twitter for iPhone,This is Benedict. He's a feisty pup. Needs a brushing. Portable af. Looks very angry actually. 4/10 might not pet https://t.co/3oeFfHjv0Z,4.0,10,Benedict,2016-03-29,01:53:39,+00:00,doggo,3184,957
997,714606013974974464,Twitter for iPhone,Here are two lil cuddly puppers. Both 12/10 would snug like so much https://t.co/zO4eb7C4tG,12.0,10,None,2016-03-29,00:12:05,+00:00,pupper,3520,891
998,714485234495041536,Vine - Make a Scene,This is Blitz. He screams. 10/10 (vid by @yeaahliv) https://t.co/MfW2aym5UF,10.0,10,Blitz,2016-03-28,16:12:09,+00:00,doggo,2584,1086
999,714258258790387713,Twitter for iPhone,"Meet Travis and Flurp. Travis is pretty chill but Flurp can't lie down properly. 10/10 &amp; 8/10
get it together Flurp https://t.co/Akzl5ynMmE",10.0,10,Travis,2016-03-28,01:10:13,+00:00,doggo,2941,703
1000,714251586676113411,Twitter for iPhone,This is Thumas. He hates potted plants. 8/10 wtf Thumas https://t.co/rDVueNIcEi,8.0,10,Thumas,2016-03-28,00:43:43,+00:00,doggo,3171,807
1001,714214115368108032,Twitter for iPhone,Happy Easter from the squad! ðŸ‡ðŸ¶ 13/10 for all https://t.co/YMx4KWJUAB,13.0,10,None,2016-03-27,22:14:49,+00:00,doggo,2208,840
1002,714141408463036416,Twitter for iPhone,"I know we only rate dogs, but since it's Easter I guess we could rate a bunny for a change. 10/10 petable as hell https://t.co/O2RlKXigHu",10.0,10,None,2016-03-27,17:25:54,+00:00,doggo,4190,1349
1003,713919462244790272,Twitter for iPhone,This is Kanu. He's a Freckled Ticonderoga. Simply flawless. 12/10 would perform an elaborate heist to capture https://t.co/7vyAzIURrE,12.0,10,Kanu,2016-03-27,02:43:58,+00:00,doggo,3192,764
1004,713909862279876608,Vine - Make a Scene,This is Doug. His nose is legendary af. 12/10 (vid by @probably_trey) https://t.co/7IWKfbfihS,12.0,10,Doug,2016-03-27,02:05:49,+00:00,doggo,1839,520
1005,713900603437621249,Twitter for iPhone,Happy Saturday here's 9 puppers on a bench. 99/90 good work everybody https://t.co/mpvaVxKmc1,99.0,90,None,2016-03-27,01:29:02,+00:00,pupper,2747,705
1006,713761197720473600,Twitter for iPhone,This is Piper. She would really like that tennis ball core. Super sneaky tongue slip. 12/10 precious af https://t.co/QP6GHi5az9,12.0,10,Piper,2016-03-26,16:15:05,+00:00,doggo,4701,1316
1007,713411074226274305,Twitter for iPhone,Here we see an extremely rare Bearded Floofmallow. Only a few left in the wild. 11/10 would pet with a purpose https://t.co/jVJJKlPbvq,11.0,10,None,2016-03-25,17:03:49,+00:00,doggo,4286,1257
1008,713177543487135744,Twitter for iPhone,This is Lance. Lance doesn't give a shit. 10/10 we should all be more like Lance https://t.co/SqnG9Ap28J,10.0,10,Lance,2016-03-25,01:35:51,+00:00,doggo,6998,2757
1009,713175907180089344,Twitter for iPhone,Say hello to Opie and Clarkus. Clarkus fell asleep so Opie buried him. Ruthless af 10/10 for both https://t.co/xT7XaY4gnW,10.0,10,Opie,2016-03-25,01:29:21,+00:00,doggo,4317,1425
1010,712809025985978368,Twitter for iPhone,This is Stubert. He just arrived. 10/10 https://t.co/HVGs5aAKAn,10.0,10,Stubert,2016-03-24,01:11:29,+00:00,doggo,18471,6488
1011,712717840512598017,Twitter for iPhone,Please don't send in any more polar bears. We only rate dogs. Thank you... 10/10 https://t.co/83RGhdIQz2,10.0,10,None,2016-03-23,19:09:09,+00:00,doggo,11939,4785
1012,712668654853337088,Twitter for iPhone,Say hello to Sunny and Roxy. They pull things out of water together. 10/10 for both https://t.co/88aedAmxcl,10.0,10,Sunny,2016-03-23,15:53:42,+00:00,doggo,4054,1173
1013,712438159032893441,Twitter for iPhone,This is Kane. He's a semi-submerged Haitian Huffleplop. Happy af. Sick waterfall. 11/10 would pat head approvingly https://t.co/7zjEC501Ul,11.0,10,Kane,2016-03-23,00:37:48,+00:00,doggo,5160,1513
1014,712309440758808576,Twitter for iPhone,"Reminder that we made our first set of stickers available! All are 12/10 would stick
Use code ""pupper"" at checkoutðŸ¶

https://t.co/kJIMNyMNKV",12.0,10,None,2016-03-22,16:06:19,+00:00,pupper,232,25
1015,712097430750289920,Twitter for iPhone,I can't even comprehend how confused this dog must be right now. 10/10 https://t.co/8AGcQ4hIfK,10.0,10,None,2016-03-22,02:03:52,+00:00,doggo,3658,998
1016,712092745624633345,Twitter for iPhone,This is Steven. He's inverted af. Also very helpful. Scans anything you want for free. Takes him a while tho. 7/10 https://t.co/tA0ZiQ7JcG,7.0,10,Steven,2016-03-22,01:45:15,+00:00,doggo,2847,856
1017,712085617388212225,Twitter for iPhone,"Say hello to Olive and Ruby. They are best buddies. Both 11/10 
1 like = 1 buddy https://t.co/yagmFdKlyL",11.0,10,Olive,2016-03-22,01:16:55,+00:00,doggo,3176,470
1018,712065007010385924,Twitter for iPhone,This is Chester. He's clearly in charge of the other dogs. Weird ass paws. Not fit for fetch. 6/10 would still pet https://t.co/o2GvskrhHt,6.0,10,Chester,2016-03-21,23:55:01,+00:00,doggo,2185,601
1019,711968124745228288,Twitter for iPhone,Meet Winston. He's trapped in a cup of coffee. Poor pupper. 10/10 someone free him https://t.co/2e6cUtKUuc,10.0,10,Winston,2016-03-21,17:30:03,+00:00,pupper,7802,2228
1020,711743778164514816,Twitter for iPhone,Meet Roosevelt. He's calculating the best case scenario if he drops out instead of doing math hw. 11/10 relatable af https://t.co/QcSIRDpfVg,11.0,10,Roosevelt,2016-03-21,02:38:34,+00:00,doggo,2759,959
1021,711732680602345472,Twitter for iPhone,I want to hear the joke this dog was just told. 10/10 https://t.co/1KiuZqqOD4,10.0,10,None,2016-03-21,01:54:29,+00:00,doggo,8551,3944
1022,711694788429553666,Twitter for iPhone,Oh. My. God. 13/10 magical af https://t.co/Ezu6jQrKAZ,13.0,10,None,2016-03-20,23:23:54,+00:00,doggo,31850,17704
1023,711652651650457602,Twitter for iPhone,This is Gary. He just wanted to say hi. 9/10 very personable pup https://t.co/Sk3CbhmKSW,9.0,10,Gary,2016-03-20,20:36:28,+00:00,doggo,3725,883
1024,711363825979756544,Twitter for iPhone,"""Please, no puparazzi"" 11/10 https://t.co/nJIXSPfedK",11.0,10,None,2016-03-20,01:28:47,+00:00,doggo,3520,1091
1025,711306686208872448,Twitter for iPhone,What hooligan sent in pictures w/out a dog in them? Churlish af. 3/10 just bc that's a neat fluffy bean bag chair https://t.co/wcwoGOkZvz,3.0,10,None,2016-03-19,21:41:44,+00:00,doggo,3198,711
1026,711008018775851008,Twitter for iPhone,This is Chuckles. He had a balloon but he accidentally let go of it and it floated away. 11/10 hang in there pupper https://t.co/68iNM7B5gW,11.0,10,Chuckles,2016-03-19,01:54:56,+00:00,pupper,2907,589
1027,710997087345876993,Twitter for iPhone,Meet Milo and Amos. They are the best of pals. Both 12/10 would pet at the same time https://t.co/Mv37BHEyyD,12.0,10,Milo,2016-03-19,01:11:29,+00:00,doggo,4433,1336
1028,710844581445812225,Twitter for iPhone,This is Staniel. His selfie game is strong af. 10/10 I'd snapchat with Staniel https://t.co/UgkTw7TKyM,10.0,10,Staniel,2016-03-18,15:05:29,+00:00,doggo,2469,657
1029,710833117892898816,Twitter for iPhone,Say hello to Sora. She's an Egyptian Pumpernickel. Mesmerizing af. 12/10 would bring home to mom https://t.co/PmTR4kxZkq,12.0,10,Sora,2016-03-18,14:19:56,+00:00,doggo,2605,512
