,tweet_id,source_app,text,rating_numerator,rating_denominator,name,date,time,timezone,dog_type,retweet_count,fav_count
1503,679062614270468097,Twitter for iPhone,This is Chompsky. He lives up to his name. 11/10 https://t.co/Xl37lQEWd0,11.0,10,Chompsky,2015-12-21,22:15:18,+00:00,doggo,16356,7722
1504,679047485189439488,Twitter for iPhone,This dog doesn't know how to stairs. Quite tragic really. 9/10 get it together pup https://t.co/kTpr9PTMg1,9.0,10,None,2015-12-21,21:15:11,+00:00,doggo,2167,635
1505,679001094530465792,Vine - Make a Scene,This is Rascal. He's paddling an imaginary canoe. 11/10 https://t.co/Ajquq6oGSg,11.0,10,Rascal,2015-12-21,18:10:50,+00:00,doggo,2741,1172
1506,678991772295516161,Twitter for iPhone,If your Monday isn't going so well just take a look at this. Both 12/10 https://t.co/GJT6SILPGU,12.0,10,None,2015-12-21,17:33:48,+00:00,doggo,2206,1104
1507,678969228704284672,Twitter for iPhone,Meet Lola. She's a Metamorphic Chartreuse. Plays with her food. Insubordinate and churlish. Exquisite hardwood 11/10 https://t.co/etpBNXwN7f,11.0,10,Lola,2015-12-21,16:04:13,+00:00,doggo,1582,435
1508,678800283649069056,Twitter for iPhone,Here's a pupper with some mean tan lines. Snazzy sweater though 12/10 https://t.co/DpCSVsl6vu,12.0,10,None,2015-12-21,04:52:53,+00:00,pupper,2479,859
1509,678798276842360832,Twitter for iPhone,This is Linda. She fucking hates trees. 7/10 https://t.co/blaY85FIxR,7.0,10,Linda,2015-12-21,04:44:55,+00:00,doggo,3331,1102
1510,678774928607469569,Twitter for iPhone,This is Tug. He's not required to wear the cone he just wants his voice to project more clearly. 11/10 https://t.co/Sp739Ou2qx,11.0,10,Tug,2015-12-21,03:12:08,+00:00,doggo,2713,865
1511,678767140346941444,Twitter for iPhone,This is Mia. She makes awful decisions. 8/10 https://t.co/G6TQVgTcZz,8.0,10,Mia,2015-12-21,02:41:11,+00:00,doggo,3405,1303
1512,678764513869611008,Twitter for iPhone,"Meet Wilson. He got caught humping the futon. He's like ""dude, help me out here"" 10/10 I'd help Wilson out https://t.co/m6XoclB0qv",10.0,10,Wilson,2015-12-21,02:30:45,+00:00,doggo,1581,447
1513,678755239630127104,Twitter for iPhone,This is Dash. He didn't think the water would be that cold. Damn it Dash it's December. Think a little. 10/10 https://t.co/NqcOwG8pxW,10.0,10,Dash,2015-12-21,01:53:54,+00:00,doggo,6828,3133
1514,678740035362037760,Twitter for iPhone,Meet Tango. He's a large dog. Doesn't care much for personal space. Owner isn't very accepting. Tongue slip. 6/10 https://t.co/p2T5kGebxe,6.0,10,Tango,2015-12-21,00:53:29,+00:00,doggo,3615,1587
1515,678708137298427904,Vine - Make a Scene,Here we are witnessing a wild field pupper. Lost his wallet in there. Rather unfortunate. 10/10 good luck pup https://t.co/sZy9Co74Bw,10.0,10,None,2015-12-20,22:46:44,+00:00,pupper,5391,2321
1516,678675843183484930,Twitter for iPhone,Exotic pup here. Tail long af. Throat looks swollen. Might breathe fire. Exceptionally unfluffy 2/10 would still pet https://t.co/a8SqCaSo2r,2.0,10,None,2015-12-20,20:38:24,+00:00,doggo,2753,1396
1517,678643457146150913,Twitter for iPhone,Meet Grizz. He just arrived. Couldn't wait until Christmas. Worried bc he saw the swastikas on the carpet. 10/10 https://t.co/QBGwYrT7rv,10.0,10,Grizz,2015-12-20,18:29:43,+00:00,doggo,1974,384
1518,678446151570427904,Twitter for iPhone,Touching scene here. Really stirs up the emotions. The bond between father &amp; son. So beautiful. 10/10 for both pups https://t.co/AJWJHov5gx,10.0,10,None,2015-12-20,05:25:42,+00:00,doggo,3855,1462
1519,678424312106393600,Twitter for iPhone,This is Crystal. She's a shitty fireman. No sense of urgency. People could be dying Crystal. 2/10 just irresponsible https://t.co/rtMtjSl9pz,2.0,10,Crystal,2015-12-20,03:58:55,+00:00,doggo,5268,2434
1520,678410210315247616,Twitter for iPhone,Say hello to Jerome. He can shoot french fries out of his mouth at insane speeds. Deadly af. 10/10 https://t.co/dIy88HwrX8,10.0,10,Jerome,2015-12-20,03:02:53,+00:00,doggo,4047,1722
1521,678399652199309312,Twitter for iPhone,This made my day. 12/10 please enjoy https://t.co/VRTbo3aAcm,12.0,10,None,2015-12-20,02:20:55,+00:00,doggo,77239,30469
1522,678396796259975168,Twitter for iPhone,These little fellas have opposite facial expressions. Both 12/10 https://t.co/LmThv0GWen,12.0,10,None,2015-12-20,02:09:34,+00:00,doggo,1533,397
1523,678389028614488064,Twitter for iPhone,"This is Bella. She just learned that her final grade in chem was a 92.49 
poor pupper 11/10 https://t.co/auOoKuoveM",11.0,10,Bella,2015-12-20,01:38:42,+00:00,pupper,1797,402
1524,678380236862578688,Twitter for iPhone,This is Crumpet. He underestimated the snow. Quickly retreating. 10/10 https://t.co/a0Zx5LDFZa,10.0,10,Crumpet,2015-12-20,01:03:46,+00:00,doggo,2341,865
1525,678341075375947776,Twitter for iPhone,This pupper likes tape. 12/10 https://t.co/cSp6w5GWgm,12.0,10,None,2015-12-19,22:28:09,+00:00,pupper,1661,511
1526,678334497360859136,Twitter for iPhone,This is Rosie. She has a snazzy bow tie and a fin for a tail. Probably super fast underwater. Cool socks 10/10 https://t.co/GO76MdGBs0,10.0,10,Rosie,2015-12-19,22:02:01,+00:00,doggo,1249,237
1527,678278586130948096,Twitter for iPhone,Another spooky pupper here. Most definitely floating. No legs. Probably knows some dark magic. 10/10 very spooked https://t.co/JK8MByRzgj,10.0,10,None,2015-12-19,18:19:51,+00:00,pupper,10993,5832
1528,678255464182861824,Twitter for iPhone,This is Jessifer. She is a Bismoth Teriyaki. Flowers being attacked by hurricanes on bandana (rad). 9/10 stellar pup https://t.co/nZhmRwZzWv,9.0,10,Jessifer,2015-12-19,16:47:58,+00:00,doggo,1529,348
1529,678021115718029313,Twitter for iPhone,This is Reese. He likes holding hands. 12/10 https://t.co/cbLroGCbmh,12.0,10,Reese,2015-12-19,01:16:45,+00:00,doggo,13101,6042
1530,677961670166224897,Vine - Make a Scene,This is Izzy. She's showing off the dance moves she's been working on. 11/10 I guess hard work pays off https://t.co/4JS92YAxTi,11.0,10,Izzy,2015-12-18,21:20:32,+00:00,doggo,3286,1611
1531,677918531514703872,Twitter for iPhone,"""Everything looks pretty good in there. Make sure to brush your gums. Been flossing? How's school going?"" Both 10/10 https://t.co/lWL2IMJqLR",10.0,10,None,2015-12-18,18:29:07,+00:00,doggo,1285,387
1532,677895101218201600,Twitter for iPhone,Guys this was terrifying. Really spooked me up. We don't rate ghosts. We rate dogs. Please only send dogs... 9/10 https://t.co/EJImi1udYb,9.0,10,None,2015-12-18,16:56:01,+00:00,doggo,4623,1976
1533,677716515794329600,Twitter for iPhone,IT'S PUPPERGEDDON. Total of 144/120 ...I think https://t.co/ZanVtAtvIq,144.0,120,None,2015-12-18,05:06:23,+00:00,doggo,2925,936
1534,677700003327029250,Twitter for iPhone,This is Ralph. He's an interpretive dancer. 10/10 https://t.co/zoDdPyPFsa,10.0,10,Ralph,2015-12-18,04:00:46,+00:00,doggo,3256,1384
1535,677698403548192770,Twitter for iPhone,This is Sadie. She got her holidays confused. 9/10 damn it Sadie https://t.co/fm7HxOsuPK,9.0,10,Sadie,2015-12-18,03:54:25,+00:00,doggo,1181,306
1536,677687604918272002,Twitter for iPhone,This was Cindy's face when she heard Susan forgot the snacks for after the kid's soccer game. 11/10 https://t.co/gzkuVGRgAD,11.0,10,None,2015-12-18,03:11:30,+00:00,doggo,2401,803
1537,677673981332312066,Twitter for iPhone,Endangered triangular pup here. Could be a wizard. Caught mid-laugh. No legs. Just fluff. Probably a wizard. 9/10 https://t.co/GFVIHIod0Z,9.0,10,None,2015-12-18,02:17:22,+00:00,doggo,3193,1434
1538,677662372920729601,Twitter for iPhone,"In honor of the new Star Wars movie. Here's Yoda pug. 12/10 pet really well, would I https://t.co/pvjdRn00XH",12.0,10,None,2015-12-18,01:31:14,+00:00,doggo,1872,903
1539,677644091929329666,Twitter for iPhone,This is a dog swinging. I really enjoyed it so I hope you all do as well. 11/10 https://t.co/Ozo9KHTRND,11.0,10,,2015-12-18,00:18:36,+00:00,doggo,1786,770
1540,677573743309385728,Twitter for iPhone,This is Sandy. He's sexually confused. Thinks he's a pigeon. Also an All-American cheese catcher. 10/10 so petable https://t.co/Htu8plSqEu,10.0,10,Sandy,2015-12-17,19:39:03,+00:00,doggo,2050,668
1541,677565715327688705,Twitter for iPhone,Contortionist pup here. Inside pentagram. Clearly worships Satan. Known to slowly push fragile stuff off tables 6/10 https://t.co/EX9oR55VMe,6.0,10,None,2015-12-17,19:07:09,+00:00,doggo,1251,438
1542,677557565589463040,Twitter for iPhone,Reckless pupper here. Not even looking at road. Absolute menace. No regard for fellow pupper lives. 10/10 still cute https://t.co/96IBkOYB7j,10.0,10,None,2015-12-17,18:34:46,+00:00,pupper,2355,1103
1543,677547928504967168,Twitter for iPhone,Not much to say here. I just think everyone needs to see this. 12/10 https://t.co/AGag0hFHpe,12.0,10,None,2015-12-17,17:56:29,+00:00,doggo,6665,3502
1544,677530072887205888,Twitter for iPhone,Say hello to Axel. He's a Black Chevy Pinot on wheels. 0 to 60 in 5.7 seconds (if downhill). 9/10 I call shotgun https://t.co/DKe9DBnnHE,9.0,10,Axel,2015-12-17,16:45:31,+00:00,doggo,1027,218
1545,677335745548390400,Vine - Make a Scene,Downright inspiring 12/10 https://t.co/vSLtYBWHcQ,12.0,10,None,2015-12-17,03:53:20,+00:00,doggo,2919,1674
1546,677334615166730240,Twitter for iPhone,This dog gave up mid jump. 9/10 https://t.co/KmMv3Y2zI8,9.0,10,None,2015-12-17,03:48:51,+00:00,doggo,1291,270
1547,677331501395156992,Twitter for iPhone,Meet Humphrey. He's a Northern Polyp Viagra. One ear works. Face stuck like that. Always surprised. 9/10 petable af https://t.co/FS7eJQM2F4,9.0,10,Humphrey,2015-12-17,03:36:28,+00:00,doggo,1046,224
1548,677328882937298944,Twitter for iPhone,This is Derek. All the dogs adore Derek. He's a great guy. 10/10 really solid pup https://t.co/KgcsGNb61s,10.0,10,Derek,2015-12-17,03:26:04,+00:00,doggo,3506,1434
1549,677314812125323265,Twitter for iPhone,"Meet Tassy &amp; Bee. Tassy is pretty chill, but Bee is convinced the Ruffles are haunted. 10/10 &amp; 11/10 respectively https://t.co/fgORpmTN9C",10.0,10,Tassy,2015-12-17,02:30:09,+00:00,doggo,1583,510
1550,677301033169788928,Twitter for iPhone,This is Juckson. He's totally on his way to a nascar race. 5/10 for Juckson https://t.co/IoLRvF0Kak,5.0,10,Juckson,2015-12-17,01:35:24,+00:00,doggo,1179,385
1551,677269281705472000,Twitter for iPhone,This is the happiest pupper I've ever seen. 10/10 would trade lives with https://t.co/ep8ATEJwRb,10.0,10,,2015-12-16,23:29:14,+00:00,pupper,1893,672
1552,677228873407442944,Twitter for iPhone,Say hello to Chuq. He just wants to fit in. 11/10 https://t.co/hGkMCjZzn4,11.0,10,Chuq,2015-12-16,20:48:40,+00:00,doggo,3406,1562
1553,677187300187611136,Twitter for iPhone,Here we see a Byzantine Rigatoni. Very aerodynamic. No eyes. Actually not windy here they just look like that. 9/10 https://t.co/gzI0m6wXRo,9.0,10,None,2015-12-16,18:03:28,+00:00,doggo,2616,870
1554,676975532580409345,Twitter for iPhone,This is Cooper. He doesn't know how cheese works. Likes the way it feels on his face. Cheeky tongue slip. 11/10 https://t.co/j1zczS0lI5,11.0,10,Cooper,2015-12-16,04:01:59,+00:00,doggo,2649,1017
1555,676957860086095872,Twitter for iPhone,10/10 I'd follow this dog into battle no questions asked https://t.co/ngTNXYQF0L,10.0,10,None,2015-12-16,02:51:45,+00:00,doggo,2147,772
1556,676949632774234114,Twitter for iPhone,This is Tyrus. He's a Speckled Centennial Ticonderoga. Terrified of floating red ball. Nifty bandana. 8/10 v petable https://t.co/HqM3YhCaaa,8.0,10,Tyrus,2015-12-16,02:19:04,+00:00,doggo,1253,375
1557,676948236477857792,Twitter for iPhone,This is Karl. Karl thinks he's slick. 6/10 sneaky pup https://t.co/Lo4ALwjVh4,6.0,10,Karl,2015-12-16,02:13:31,+00:00,doggo,2060,819
1558,676946864479084545,Twitter for iPhone,This pups goal was to get all four feet as close to each other as possible. Valiant effort 12/10 https://t.co/2mXALbgBTV,12.0,10,None,2015-12-16,02:08:04,+00:00,doggo,1659,347
1559,676942428000112642,Twitter for iPhone,Who leaves the last cupcake just sitting there? 9/10 https://t.co/PWMqAoEx2a,9.0,10,None,2015-12-16,01:50:26,+00:00,doggo,1981,711
1560,676936541936185344,Twitter for iPhone,Here we see a rare pouched pupper. Ample storage space. Looks alert. Jumps at random. Kicked open that door. 8/10 https://t.co/mqvaxleHRz,8.0,10,None,2015-12-16,01:27:03,+00:00,pupper,12207,4718
1561,676916996760600576,Vine - Make a Scene,Super speedy pupper. Does not go gentle into that goodnight. 10/10 https://t.co/uPXBXS1XNb,10.0,10,None,2015-12-16,00:09:23,+00:00,pupper,2846,1723
1562,676897532954456065,Twitter for iPhone,Exotic handheld dog here. Appears unathletic. Feet look deadly. Can be thrown a great distance. 5/10 might pet idk https://t.co/Avq4awulqk,5.0,10,None,2015-12-15,22:52:02,+00:00,doggo,2150,691
1563,676864501615042560,Twitter for iPhone,Meet Ash. He's just a head now. Lost his body during the Third Crusade. Still in good spirits. 10/10 would pet well https://t.co/NJj2uP0atK,10.0,10,Ash,2015-12-15,20:40:47,+00:00,doggo,2000,668
1564,676821958043033607,Twitter for iPhone,Finally some constructive political change in this country. 11/10 https://t.co/mvQaETHVSb,11.0,10,None,2015-12-15,17:51:44,+00:00,doggo,21921,14779
1565,676819651066732545,Twitter for iPhone,Watch out Airbud. This pupper is also good at the sports. 12/10 I'm thinking D1 https://t.co/1HrFdo7M0C,12.0,10,None,2015-12-15,17:42:34,+00:00,pupper,1744,632
1566,676811746707918848,Twitter for iPhone,Say hello to Penny &amp; Gizmo. They are practicing their caroling. The ambition in the room is tangible. 9/10 for both https://t.co/aqBHjjh5VD,9.0,10,Penny,2015-12-15,17:11:09,+00:00,doggo,1370,407
1567,676776431406465024,Twitter for iPhone,"When someone yells ""cops!"" at a party and you gotta get your drunk friend out of there. 10/10 https://t.co/4rMZi5Ca1k",10.0,10,None,2015-12-15,14:50:49,+00:00,doggo,4777,1929
1568,676617503762681856,Twitter for iPhone,I promise this wasn't meant to be a cuteness overload account but ermergerd look at this cozy pupper. 13/10 https://t.co/mpQl2rJjDh,13.0,10,None,2015-12-15,04:19:18,+00:00,pupper,2759,909
1569,676613908052996102,Twitter for iPhone,This is the saddest/sweetest/best picture I've been sent. 12/10 ðŸ˜¢ðŸ¶ https://t.co/vQ2Lw1BLBF,12.0,10,,2015-12-15,04:05:01,+00:00,doggo,1033,191
1570,676606785097199616,Twitter for iPhone,*screeches for a sec and then faints* 12/10 https://t.co/N5QL4ySBEx,12.0,10,None,2015-12-15,03:36:42,+00:00,doggo,1814,412
1571,676603393314578432,Twitter for iPhone,This is Godzilla pupper. He had a ruff childhood &amp; now deflects that pain outward by terrorizing cities. Tragic 9/10 https://t.co/g1tLGkyaxr,9.0,10,Godzilla,2015-12-15,03:23:14,+00:00,pupper,1109,363
1572,676593408224403456,Vine - Make a Scene,This pupper loves leaves. 11/10 for committed leaf lover https://t.co/APvLqbEhkF,11.0,10,None,2015-12-15,02:43:33,+00:00,pupper,4369,2048
1573,676588346097852417,Twitter for iPhone,This is Bubbles. He kinda resembles a fish. Always makes eye contact with u no matter what. Sneaky tongue slip. 5/10 https://t.co/Nrhvc5tLFT,5.0,10,Bubbles,2015-12-15,02:23:26,+00:00,doggo,2195,743
1574,676582956622721024,Twitter for iPhone,"Meet Vinnie. He's having fun while being safe. Well not a lot of fun, but definitely safe, and that's important 8/10 https://t.co/vZYtynZZlH",8.0,10,Vinnie,2015-12-15,02:02:01,+00:00,doggo,1139,261
1575,676575501977128964,Twitter for iPhone,This pupper is very passionate about Christmas. Wanted to give the tree a hug. So cute. 8/10 https://t.co/NsGyECJuq7,8.0,10,None,2015-12-15,01:32:24,+00:00,pupper,2462,1063
1576,676533798876651520,Twitter for iPhone,ITSOFLUFFAYYYYY 12/10 https://t.co/bfw13CnuuZ,12.0,10,None,2015-12-14,22:46:41,+00:00,doggo,1797,521
1577,676496375194980353,Twitter for iPhone,Say hello to Griffin. He's upset because his costume for Halloween didn't arrive until today. 9/10 cheer up pup https://t.co/eoBCjSFajX,9.0,10,Griffin,2015-12-14,20:17:59,+00:00,doggo,1459,508
1578,676470639084101634,Twitter for iPhone,Three generations of pupper. 11/10 for all https://t.co/tAmQYvzrau,11.0,10,None,2015-12-14,18:35:43,+00:00,pupper,11115,4445
1579,676440007570247681,Twitter for iPhone,Hope your Monday isn't too awful. Here's two baseball puppers. 11/10 for each https://t.co/dB0H9hdZai,11.0,10,None,2015-12-14,16:34:00,+00:00,pupper,1654,627
1580,676430933382295552,Twitter for iPhone,"Meet Duke. He's an Urban Parmesan. They know he's scared of the green rubber dog. ""Why u do dis?"" thinks Duke. 10/10 https://t.co/3bim9U5Idr",10.0,10,Duke,2015-12-14,15:57:56,+00:00,doggo,1338,321
1581,676263575653122048,Twitter for iPhone,All this pupper wanted to do was go skiing. No one told him about the El NiÃ±o. Poor pupper. 10/10 maybe next year https://t.co/fTgbq1UBR9,10.0,10,None,2015-12-14,04:52:55,+00:00,pupper,1995,512
1582,676237365392908289,Twitter for iPhone,Say hello to Winston. He has no respect for the system. Much rebellion. I think that's a palm tree... nice. 8/10 https://t.co/dOLQddhXLZ,8.0,10,Winston,2015-12-14,03:08:46,+00:00,doggo,1156,268
1583,676219687039057920,Twitter for iPhone,This is Kenneth. He's stuck in a bubble. 10/10 hang in there Kenneth https://t.co/uQt37xlYMJ,10.0,10,Kenneth,2015-12-14,01:58:31,+00:00,doggo,73167,29457
1584,676215927814406144,Twitter for iPhone,This is Herm. He just wants to be like the other dogs. Sneaky tongue slip. Super fuzzy. 9/10 would cuddle firmly https://t.co/tg8h9lzCHv,9.0,10,Herm,2015-12-14,01:43:35,+00:00,doggo,1656,546
1585,676191832485810177,Twitter for iPhone,These two pups just met and have instantly bonded. Spectacular scene. Mesmerizing af. 10/10 and 7/10 for blue dog https://t.co/gwryaJO4tC,10.0,10,None,2015-12-14,00:07:50,+00:00,doggo,2177,983
1586,676146341966438401,Twitter for iPhone,This is Bert. He likes flowers. 10/10 https://t.co/lmQRrNxaQu,10.0,10,Bert,2015-12-13,21:07:04,+00:00,doggo,1838,631
1587,676121918416756736,Vine - Make a Scene,Here we are witnessing a very excited dog. Clearly has no control over neck movements. 8/10 would still pet https://t.co/ICNIjSkrXs,8.0,10,None,2015-12-13,19:30:01,+00:00,doggo,2064,1104
1588,676101918813499392,Twitter for iPhone,Meet Striker. He's ready for Christmas. 11/10 https://t.co/B3xxSLjQSH,11.0,10,Striker,2015-12-13,18:10:33,+00:00,doggo,2705,1114
1589,676098748976615425,Twitter for iPhone,Extremely rare pup here. Very religious. Always praying. Too many legs. Not overwhelmingly fluffy. Won't bark. 3/10 https://t.co/REyE5YKVBb,3.0,10,None,2015-12-13,17:57:57,+00:00,doggo,2852,1343
1590,676089483918516224,Twitter for iPhone,"""Yes hello I'ma just snag this here toasted bagel real quick. carry on."" 9/10 https://t.co/Cuz0Osnekp",9.0,10,None,2015-12-13,17:21:08,+00:00,doggo,1253,415
1591,675898130735476737,Twitter for iPhone,I'm sure you've all seen this pupper. Not prepared at all for the flying disc of terror. 10/10 https://t.co/G0pQiFGM7O,10.0,10,None,2015-12-13,04:40:46,+00:00,pupper,1537,537
1592,675891555769696257,Twitter for iPhone,This is Donny. He's summoning the demon monster Babadook. 6/10 Donny please no that won't be a good time for anyone https://t.co/kiW6Knb7Gp,6.0,10,Donny,2015-12-13,04:14:39,+00:00,doggo,2026,812
1593,675888385639251968,Twitter for iPhone,Breathtaking scene. A father taking care of his newborn pup. Tugs at the heartstrings. 10/10 restores my faith https://t.co/06oZdehGEa,10.0,10,None,2015-12-13,04:02:03,+00:00,doggo,2260,904
1594,675878199931371520,Twitter for iPhone,"Ok, I'll admit this is a pretty adorable bunny hopping towards the ocean but please only send in dogs... 11/10 https://t.co/sfsVCGIipI",11.0,10,None,2015-12-13,03:21:34,+00:00,doggo,3977,1322
1595,675853064436391936,Twitter for iPhone,Here we have an entire platoon of puppers. Total score: 88/80 would pet all at once https://t.co/y93p6FLvVw,88.0,80,None,2015-12-13,01:41:41,+00:00,pupper,2564,1214
1596,675845657354215424,Twitter for iPhone,"This is Pepper. She's not fully comfortable riding her imaginary bike yet. 10/10 don't worry pupper, it gets easier https://t.co/40dj4eTsXG",10.0,10,Pepper,2015-12-13,01:12:15,+00:00,pupper,2156,828
1597,675822767435051008,Twitter for iPhone,ðŸŽ¶ HELLO FROM THE OTHER SIIIIIIIIDE ðŸŽ¶ 10/10s https://t.co/GK2HJtkdQk,10.0,10,None,2015-12-12,23:41:18,+00:00,doggo,1448,510
1598,675820929667219457,Twitter for iPhone,Here's a handful of sleepy puppers. All look unaware of their surroundings. Lousy guard dogs. Still cute tho 11/10s https://t.co/lyXX3v5j4s,11.0,10,None,2015-12-12,23:34:00,+00:00,pupper,1002,224
1599,675798442703122432,Twitter for iPhone,This is Bernie. He just touched a boob for the first time. 10/10 https://t.co/whQKMygnK6,10.0,10,Bernie,2015-12-12,22:04:39,+00:00,doggo,9765,3245
1600,675781562965868544,Twitter for iPhone,Say hello to Buddah. He was Waldo for Halloween. 11/10 https://t.co/DVAqAnb624,11.0,10,Buddah,2015-12-12,20:57:34,+00:00,doggo,1541,445
1601,675740360753160193,Twitter for iPhone,Here's a pupper licking in slow motion. 12/10 please enjoy https://t.co/AUJi8ujxw9,12.0,10,None,2015-12-12,18:13:51,+00:00,pupper,1112,321
1602,675710890956750848,Twitter for iPhone,This is Lenny. He was just told that he couldn't explore the fish tank. 12/10 smh all that work for nothing https://t.co/JWi6YrpiO1,12.0,10,Lenny,2015-12-12,16:16:45,+00:00,doggo,1791,769
1603,675706639471788032,Twitter for iPhone,This is a Sizzlin Menorah spaniel from Brooklyn named Wylie. Lovable eyes. Chiller as hell. 10/10 and I'm out.. poof https://t.co/7E0AiJXPmI,10.0,10,,2015-12-12,15:59:51,+00:00,doggo,617,89
1604,675534494439489536,Twitter for iPhone,Seriously guys?! Only send in dogs. I only rate dogs. This is a baby black bear... 11/10 https://t.co/H7kpabTfLj,11.0,10,,2015-12-12,04:35:48,+00:00,doggo,1747,387
1605,675531475945709568,Twitter for iPhone,This is Ellie AKA Queen Slayer of the Orbs. Very self-motivated. Great yard. Rad foliage. 10/10 would pet diligently https://t.co/c9jmg3Xtzn,10.0,10,Ellie,2015-12-12,04:23:49,+00:00,doggo,1121,361
1606,675522403582218240,Twitter for iPhone,Meet Sammy. He's a Motorola Firefox. Hat under hoodie (must be a half-decent up and coming white rapper) 10/10 https://t.co/rO2zxf0OQ0,10.0,10,Sammy,2015-12-12,03:47:46,+00:00,doggo,988,272
1607,675517828909424640,Twitter for iPhone,12/10 stay woke https://t.co/XDiQw4Akiw,12.0,10,None,2015-12-12,03:29:35,+00:00,doggo,1231,439
1608,675501075957489664,Twitter for iPhone,"I shall call him squishy and he shall be mine, and he shall be my squishy. 13/10 https://t.co/WId5lxNdPH",13.0,10,None,2015-12-12,02:23:01,+00:00,doggo,16340,5529
1609,675497103322386432,Twitter for iPhone,Meet Reggie. He's going for the world record. Must concentrate. Focus up pup. 11/10 we all believe in you Reggie https://t.co/h3AWz4AzuC,11.0,10,Reggie,2015-12-12,02:07:14,+00:00,doggo,2989,1217
1610,675489971617296384,Twitter for iPhone,RT until we find this dog. Clearly a cool dog (front leg relaxed out window). Looks to be a superb driver. 10/10 https://t.co/MnTrKaQ8Wn,10.0,10,None,2015-12-12,01:38:53,+00:00,doggo,1226,563
1611,675483430902214656,Twitter for iPhone,Rare shielded battle dog here. Very happy about abundance of lettuce. Painfully slow fetcher. Still petable. 5/10 https://t.co/C3tlKVq7eO,5.0,10,None,2015-12-12,01:12:54,+00:00,doggo,1756,921
1612,675432746517426176,Twitter for iPhone,Happy Friday. Here's some golden puppers. 12/10 for all https://t.co/wNkqAED6lG,12.0,10,None,2015-12-11,21:51:30,+00:00,pupper,1445,540
1613,675372240448454658,Twitter for iPhone,"The tail alone is 13/10. Great dog, better owner https://t.co/IyAXinfyju",13.0,10,None,2015-12-11,17:51:04,+00:00,doggo,1604,490
1614,675362609739206656,Twitter for iPhone,This is Daisy. She loves that shoe. Still no seat belt. Super churlish. 12/10 the dogs are killing it today https://t.co/cZlkvgRPdn,12.0,10,Daisy,2015-12-11,17:12:48,+00:00,doggo,1004,215
1615,675354435921575936,Twitter Web Client,Everyone needs to watch this. 13/10 https://t.co/Bb3xnpsWBC,13.0,10,None,2015-12-11,16:40:19,+00:00,doggo,30877,15818
1616,675334060156301312,Twitter for iPhone,Good morning here's a grass pupper. 12/10 https://t.co/2d68FmWGGs,12.0,10,None,2015-12-11,15:19:21,+00:00,pupper,2627,1212
1617,675166823650848770,Twitter for iPhone,This is Arnold. He broke his leg saving a handicapped child from a forest fire. True hero. 10/10 inspirational dog https://t.co/bijCeHeX4C,10.0,10,Arnold,2015-12-11,04:14:49,+00:00,doggo,3371,1491
1618,675153376133427200,Twitter for iPhone,What kind of person sends in a picture without a dog in it? 1/10 just because that's a nice table https://t.co/RDXCfk8hK0,1.0,10,None,2015-12-11,03:21:23,+00:00,doggo,5921,2422
1619,675149409102012420,Twitter for iPhone,holy shit 12/10 https://t.co/p6O8X93bTQ,12.0,10,None,2015-12-11,03:05:37,+00:00,doggo,3548,1595
1620,675147105808306176,Twitter for iPhone,When you're presenting a group project and the 4th guy tells the teacher that he did all the work. 10/10 https://t.co/f50mbB4UWS,10.0,10,None,2015-12-11,02:56:28,+00:00,doggo,896,218
1621,675146535592706048,Twitter for iPhone,This is Coops. He's yelling at the carpet. Not very productive Coops. 7/10 https://t.co/Uz52oYnHzF,7.0,10,Coops,2015-12-11,02:54:12,+00:00,doggo,1118,276
1622,675145476954566656,Twitter for iPhone,What an honor. 3 dogs here. Blond one is clearly a gymnast. Other two just confused. Very nifty pups. 9/10 for all https://t.co/YDgstgIDGs,9.0,10,None,2015-12-11,02:49:59,+00:00,doggo,2029,842
1623,675135153782571009,Twitter for iPhone,This is Steven. He got locked outside. Damn it Steven. 5/10 nice grill tho https://t.co/zf7Sxxjfp3,5.0,10,Steven,2015-12-11,02:08:58,+00:00,doggo,1233,445
1624,675113801096802304,Twitter for iPhone,Meet Zuzu. He just graduated college. Astute pupper. Needs 2 leashes to contain him. Wasn't ready for the pic. 10/10 https://t.co/2H5SKmk0k7,10.0,10,Zuzu,2015-12-11,00:44:07,+00:00,pupper,1847,741
